00008,r6k/pp2r2p/4Rp1Q/3p4/8/1N1P2R1/PqP2bPP/7K b - - 0 24,f2g3 e6e7 b2b1 b3c1 b1c1 h6c1,1890,75,96,2240,crushing hangingPiece long middlegame,https://lichess.org/787zsVup/black#48,
0000D,5rk1/1p3ppp/pq3b2/8/8/1P1Q1N2/P4PPP/3R2K1 w - - 2 27,d3d6 f8d8 d6d8 f6d8,1556,73,96,13922,advantage endgame short,https://lichess.org/F8M8OS71#53,
0009B,r2qr1k1/b1p2ppp/pp4n1/P1P1p3/4P1n1/B2P2Pb/3NBP1P/RN1QR1K1 b - - 1 16,b6c5 e2g4 h3g4 d1g4,1088,75,85,506,advantage middlegame short,https://lichess.org/4MWQCxQ6/black#32,Kings_Pawn_Game,Kings_Pawn_Game_Leonardis_Variation
000aY,r4rk1/pp3ppp/2n1b3/q1pp2B1/8/P1Q2NP1/1PP1PP1P/2KR3R w - - 0 15,g5e7 a5c3 b2c3 c6e7,1457,75,86,482,advantage master middlegame short,https://lichess.org/iihZGl6t#29,Benoni_Defense,Benoni_Defense_Benoni-Indian_Defense
000hf,r1bqk2r/pp1nbNp1/2p1p2p/8/2BP4/1PN3P1/P3QP1P/3R1RK1 b kq - 0 19,e8f7 e2e6 f7f8 e6f7,1595,77,88,448,mate mateIn2 middlegame short,https://lichess.org/71ygsFeE/black#38,Horwitz_Defense,Horwitz_Defense_Other_variations
000mr,5r1k/5rp1/p7/1b2B2p/1P1P1Pq1/2R1Q3/P3p1P1/2R3K1 w - - 0 41,e3g3 f7f4 e5f4 f8f4,1500,500,100,1,crushing middlegame short,https://lichess.org/8sVpuwso#81,
000rO,3R4/8/K7/pB2b3/1p6/1P2k3/3p4/8 w - - 4 58,a6a5 e5c7 a5b4 c7d8,1039,80,85,55,crushing endgame fork short,https://lichess.org/tzeeBEc2#115,
000tp,4r3/5pk1/1p3np1/3p3p/2qQ4/P4N1P/1P3RP1/7K w - - 6 34,d4b6 f6e4 h1g1 e4f2,2040,75,81,107,crushing endgame short trappedPiece,https://lichess.org/GeXqsW90#67,
00143,r2q1rk1/5ppp/1np5/p1b5/2p1B3/P7/1P3PPP/R1BQ1RK1 b - - 1 17,d8f6 d1h5 h7h6 h5c5,1865,74,90,1589,advantage middlegame short,https://lichess.org/jcuxlI63/black#34,Scotch_Game,Scotch_Game_Mieses_Variation
0018S,2kr3r/pp3p2/4p2p/1N1p2p1/3Q4/1P1P4/2q2PPP/5RK1 b - - 1 20,b7b6 d4a1 a7a5 f1c1,2521,83,90,1314,advantage endgame pin short,https://lichess.org/H1ARO2GL/black#40,
001Wz,4r1k1/5ppp/r1p5/p1n1RP2/8/2P2N1P/2P3P1/3R2K1 b - - 0 21,e8e5 d1d8 e5e8 d8e8,1128,81,87,54,backRankMate endgame mate mateIn2 short,https://lichess.org/84RH3LaP/black#42,
001XA,1qr2rk1/pb2bppp/8/8/2p1N3/P1Bn2P1/2Q2PBP/1R3RK1 b - - 3 23,b8c7 b1b7 c7b7 e4f6 e7f6 g2b7,1796,74,92,620,crushing discoveredAttack long master middlegame sacrifice,https://lichess.org/KZRiN695/black#46,
001gi,r6r/1pNk1ppp/2np4/b3p3/4P1b1/N1Q5/P4PPP/R3KB1R w KQ - 3 18,c7a8 a5c3,1013,168,39,136,bodenMate hangingPiece mate mateIn1 middlegame oneMove,https://lichess.org/1sV2Hr22#35,Sicilian_Defense,Sicilian_Defense_Other_variations
001om,5r1k/pp4pp/5p2/1BbQp1r1/6K1/7P/1PP3P1/3R3R w - - 2 26,g4h4 c5f2 g2g3 f2g3,991,78,89,215,mate mateIn2 middlegame short,https://lichess.org/VWOIWtIh#51,
001u3,2r3k1/p1q2pp1/Q3p2p/b1Np4/2nP1P2/4P1P1/5K1P/2B1N3 b - - 3 33,c7b6 a6c8 g8h7 c8b7,2175,81,55,71,advantage hangingPiece middlegame short,https://lichess.org/BBn6ipaK/black#66,
001w5,1rb2rk1/q5P1/4p2p/3p3p/3P1P2/2P5/2QK3P/3R2R1 b - - 0 29,f8f7 c2h7 g8h7 g7g8q,1444,140,79,20,advancedPawn attraction mate mateIn2 middlegame promotion short,https://lichess.org/0e1vxAEn/black#58,
001wb,r3k2r/pb1p1ppp/1b4q1/1Q2P3/8/2NP1Pn1/PP4PP/R1B2R1K w kq - 1 17,h2g3 g6h5,1487,293,50,13,mate mateIn1 middlegame oneMove,https://lichess.org/hNzYRMWP#33,Ruy_Lopez,Ruy_Lopez_Bird_Variation
001wr,r4rk1/p3ppbp/Pp1q1np1/3PpbB1/2B5/2N5/1PPQ1PPP/3RR1K1 w - - 4 18,f2f3 d6c5 g1h1 c5c4,991,76,96,1127,advantage fork master masterVsMaster middlegame short,https://lichess.org/KnJ2mojX#35,Pirc_Defense,Pirc_Defense_Classical_Variation
001xO,k1r1b3/p1r1nppp/1p1qpn2/2Np4/1P1P4/PQRBPN2/5PPP/2R3K1 w - - 0 19,d3a6 b6c5 a6c8 c5c4,1906,74,93,652,crushing master masterVsMaster middlegame sacrifice short,https://lichess.org/fNCePFgY#37,Slav_Defense,Slav_Defense_Other_variations
001xl,8/4R1k1/p5pp/3B4/5q2/8/5P1P/6K1 b - - 5 40,g7f6 e7f7 f6e5 f7f4,1192,74,96,7530,advantage endgame master masterVsMaster short skewer superGM,https://lichess.org/bEQkfPQD/black#80,
00206,r3kb1r/pppqpn1p/5p2/3p1bpQ/2PP4/4P1B1/PP3PPP/RN2KB1R w KQkq - 1 11,b1c3 f5g4 h5g4 d7g4,1558,74,96,13124,advantage opening short trappedPiece,https://lichess.org/MbJRo6PT#21,Queens_Pawn_Game,Queens_Pawn_Game_Mason_Variation
002Cw,r7/2p2r1k/p2p1q1p/Pp1P4/1P2P3/2PQ4/6R1/R5K1 b - - 2 28,f7g7 e4e5 f6g6 g2g6,1054,75,95,742,crushing discoveredAttack endgame short,https://lichess.org/lxiSa85s/black#56,
002E4,8/8/kpq5/p4pQp/P7/7P/3r2P1/4R2K b - - 10 48,c6a4 g5d2,974,92,18,38,crushing endgame hangingPiece oneMove,https://lichess.org/JwMca3Nw/black#96,
002IE,r3brk1/5pp1/p1nqpn1p/P2pN3/2pP4/2P1PN2/5PPP/RB1QK2R b KQ - 4 16,c6e5 d4e5 d6e7 e5f6,1303,100,47,19,advantage fork middlegame short,https://lichess.org/fDwvVUIp/black#32,Queens_Pawn_Game,Queens_Pawn_Game_Mason_Variation
002KJ,r3kb1r/ppq2ppp/4pn2/2Ppn3/1P4bP/2P2N2/P3BPP1/RNBQ1RK1 b kq - 2 10,f8e7 f3e5 c7e5 e2g4,1492,75,93,589,crushing discoveredAttack middlegame short,https://lichess.org/2NpTzh7O/black#20,Caro-Kann_Defense,Caro-Kann_Defense_Advance_Variation
002LW,3r1rk1/1b1n1pp1/3p4/p4PPQ/4P3/3q1BN1/8/2R2RK1 b - - 1 28,d7e5 f5f6 e5f3 f1f3,2476,88,77,101,advantage middlegame short,https://lichess.org/0khwj5dv/black#56,
002Tf,r3kbnr/ppp1qppp/2n5/3pP3/5B2/4PQ2/PPP2PPP/RN2KB1R w KQkq - 1 7,f1b5 e7b4 b1c3 b4b2,1579,76,85,152,advantage fork opening short,https://lichess.org/Zq56PwHK#13,
002Ua,r4rk1/pp3ppp/3p1q2/P1P1p3/2B5/2B2n2/2P2P1P/R2Q1RK1 w - - 0 16,g1h1 f6f4 d1f3 f4f3,1743,75,96,1974,crushing kingsideAttack middlegame short,https://lichess.org/06i3eMVp#31,Sicilian_Defense,Sicilian_Defense_Lowenthal_Variation
002VP,8/6p1/2B1bn2/6k1/3B4/6K1/4P3/8 b - - 4 44,e6d5 d4f6 g5f5 c6d5,1368,81,69,124,crushing endgame short,https://lichess.org/7yJGEbUK/black#88,
002rd,r6k/q1pb1p1p/1b3Pr1/p1ppP2Q/3P2p1/4B3/PP2NRPP/3R2K1 b - - 1 25,d7e6 e2f4 c5d4 f4g6 f7g6 h5h6,1500,500,100,1,crushing kingsideAttack long middlegame pin,https://lichess.org/NcD6lul8/black#50,
002uV,r2r2k1/1p2qppp/2n1p3/5n2/p2P4/P2Q1N2/BP3PPP/2R1R1K1 w - - 4 20,d3f5 e6f5 e1e7 c6e7,1613,77,82,62,advantage middlegame short,https://lichess.org/WKH5eIti#39,
002xh,2nk4/8/2PBp1n1/1pK1P1p1/1P4P1/8/8/8 b - - 2 42,g6h4 c5b5 h4g2 b5a6 g2e3 a6b7,2074,101,54,24,crushing endgame long,https://lichess.org/TfRvsd3p/black#84,
0039T,1r5r/p3kp2/4p2p/4P3/3R1Pp1/6P1/P1P4P/4K2R w K - 1 25,d4a4 b8b1 e1f2 b1h1 a4a7 e7f8,1254,105,100,46,crushing defensiveMove endgame long rookEndgame skewer,https://lichess.org/BrtVeJlj#49,
003IX,8/3pk3/R7/1R2Pp1p/2PPnKr1/8/8/8 w - - 4 43,f4f5 e4g3,1663,84,83,446,endgame mate mateIn1 oneMove,https://lichess.org/576Btq56#85,
003Jb,6k1/3bqr1p/2rpp1pR/p7/Pp1QP3/1B3P2/1PP3P1/2KR4 w - - 6 22,d4a7 e7g5 c1b1 g5h6,994,77,90,363,advantage fork middlegame short,https://lichess.org/8RvK0idj#43,
003Tx,2r5/pR5p/5p1k/4p3/4r3/B4nPP/PP3P2/1K2R3 w - - 0 27,e1e4 f3d2 b1a1 c8c1,1667,80,85,527,backRankMate endgame fork mate mateIn2 short,https://lichess.org/A7j9VEC0#53,
003YT,r1bqk1nr/1pp2ppp/p1pb4/4p3/3PP3/5N2/PPP2PPP/RNBQ1RK1 b kq - 0 6,d8f6 d4e5 d6e5 c1g5 f6d6 f3e5 d6d1 f1d1,1729,167,-60,13,advantage fork opening veryLong,https://lichess.org/TAffogpQ/black#12,
003eP,8/r1b1q2k/2p3p1/2Pp4/1P2p1n1/2B1P3/NQ6/2K4R b - - 1 36,h7g8 h1h8 g8f7 h8h7 f7e8 h7e7,1089,79,93,1604,crushing exposedKing long middlegame skewer,https://lichess.org/n9vCFmKh/black#72,
003jH,rn3rk1/p5pp/3N4/4np1q/5Q2/1P3K2/PB1P2P1/2R4R w - - 0 25,f3f2 e5d3 f2e3 d3f4 h1h5 f4h5,1146,75,89,270,crushing fork long middlegame,https://lichess.org/3CQGofXT#49,
003jb,r3kb1r/p4ppp/b1p1p3/3q4/3Q4/4BN2/PPP2PPP/R3K2R b KQkq - 0 11,c6c5 d4a4 a6b5 a4b5,1089,77,95,624,crushing fork middlegame short,https://lichess.org/960EzUS0/black#22,French_Defense,French_Defense_Classical_Variation
003jv,1R6/1p2k2p/p2n2p1/4K3/8/6P1/P6P/8 w - - 10 37,b8h8 d6f7 e5e4 f7h8,986,82,89,332,crushing endgame fork short,https://lichess.org/n0UvwK36#73,
003md,r1b1k2N/ppp3pp/2n5/2bp4/7q/1B4n1/PPPP1P1P/RNBQ1RK1 w q - 0 10,f1e1 g3e4 e1e4 d5e4 d1h5 h4h5 b3f7 h5f7,2172,78,83,196,crushing defensiveMove middlegame veryLong,https://lichess.org/ALtR2fxT#19,Russian_Game,Russian_Game_Italian_Variation
003nQ,6rk/pp6/2n5/3ppn1p/3p4/2P2P1q/PP3QNB/R4R1K w - - 2 29,f1g1 f5g3 f2g3 g8g3,1307,91,65,23,crushing kingsideAttack master middlegame pin short,https://lichess.org/p85fiZcl#57,
003o0,r1bqk2r/pp1nbppp/3p4/1B1p4/3P1B2/8/PPP2PPP/R2QK1NR w KQkq - 2 9,g1f3 d8a5 d1d2 a5b5,1073,76,90,626,advantage fork master opening short,https://lichess.org/Ae0t9V1Z#17,
003r5,r2qr1k1/ppp2ppp/4b3/3P4/1nP2Q2/2N2N1P/PP3KP1/R4R2 w - - 1 15,d5e6 b4d3 f2g1 d3f4,1261,75,93,480,crushing fork middlegame short,https://lichess.org/JPN97v7j#29,Kings_Gambit_Accepted,Kings_Gambit_Accepted_Abbazia_Defense
003wQ,2r2rk1/6pp/3Q1q2/8/3N1B2/6P1/PP1K3P/R4b2 w - - 0 24,a1f1 f6d6 f4d6 f8f1,1910,75,92,814,advantage discoveredAttack middlegame pin short,https://lichess.org/W3wvnzlo#47,
0042j,3r2k1/4nppp/pq1p1b2/1p2P3/2r2P2/2P1NR2/PP1Q2BP/3R2K1 b - - 0 24,d6e5 d2d8 b6d8 d1d8,685,81,98,539,backRankMate mate mateIn2 middlegame short,https://lichess.org/DuM2FZjg/black#48,
0045Q,rnbqkb1r/pppp2pp/8/4P3/2B5/4p3/PPPP2PP/R1BQK1NR w KQkq - 0 7,d1f3 d8h4 e1d1 h4c4,1608,77,97,10998,advantage fork opening short,https://lichess.org/fTegzZIT#13,
0048h,4r3/p5k1/2p2R1p/2Pp4/1P1pr1P1/P6P/8/3R3K w - - 1 35,f6c6 e4e1 d1e1 e8e1 h1g2 d4d3,1099,133,86,17,crushing endgame exposedKing long rookEndgame,https://lichess.org/dq15P00L#69,
004Ao,4qk2/1b3rR1/p7/1p2Q3/4P2P/P2P3K/2r5/3R4 w - - 5 41,g7f7 e8f7 e5h8 f8e7,1735,99,86,16,advantage endgame short,https://lichess.org/aFlzjb1K#81,
004BW,r1bk2r1/ppq2pQp/3bpn2/1BpnN3/5P2/1P6/PBPP2PP/RN2K2R w KQ - 3 13,e5f7 d8e7 g7g8 f6g8,1694,74,92,584,advantage middlegame short,https://lichess.org/EXlG6TZs#25,Sicilian_Defense,Sicilian_Defense_Modern_Variations
004LZ,8/7R/5p2/p7/7P/2p5/3k2r1/1K2N3 w - - 3 48,e1g2 c3c2 b1a2 c2c1q h7d7 d2e2,1186,74,91,1749,advancedPawn crushing defensiveMove deflection endgame long promotion,https://lichess.org/drahwNdj#95,
004Op,2kr2r1/1bp4n/1pq1p2p/p1P5/1P3B2/P6P/5RP1/RB2Q1K1 w - - 3 26,e1f1 d8d1 f1d1 g8g2 g1f1 g2g1 f1e2 g1d1,2225,78,91,669,crushing deflection kingsideAttack middlegame pin sacrifice skewer veryLong,https://lichess.org/tneg9Bzk#51,
004RF,5rk1/5ppp/1p6/1qp2P1Q/3p3P/6R1/6PK/8 b - - 0 30,c5c4 g3g7 g8g7 f5f6 g7f6 h5b5,1698,90,89,29,attraction crushing discoveredAttack endgame long sacrifice,https://lichess.org/2UeWcE4h/black#60,
004X6,1r4k1/p4ppp/2Q5/3pq3/8/P6P/2PR1PP1/Rr4K1 w - - 1 26,a1b1 b8b1 d2d1 b1d1,1176,278,83,10,endgame mate mateIn2 short,https://lichess.org/wvPFkjF9#51,
004Ys,r4rk1/3q1pbp/p1n1p1p1/2p3NP/1p3B2/3P3Q/PPP3P1/R3R1K1 b - - 2 19,d7d4 f4e3 d4f6 e1f1 f6e5 h5g6 e5e3 h3e3,2219,85,90,178,advantage defensiveMove middlegame veryLong,https://lichess.org/LcIJdugn/black#38,Sicilian_Defense,Sicilian_Defense_McDonnell_Attack
004d8,8/4kr2/R2p4/1p1Pp1p1/5p2/3K1P2/PPP5/8 b - - 0 39,g5g4 a6a7 e7f6 a7f7 f6f7 f3g4,1520,124,100,21,crushing endgame long rookEndgame,https://lichess.org/FrR3BHbW/black#78,
004iZ,r2r2k1/2q1bpp1/3p1n1p/1ppN4/1P1BP3/P5Q1/4RPPP/R5K1 b - - 1 20,f6d5 g3g7,1005,75,98,569,kingsideAttack mate mateIn1 middlegame oneMove,https://lichess.org/dQ85JUe1/black#40,
004kB,4rr1k/pQpn2pp/3p1q2/8/8/2P5/PP3PPP/RN3RK1 w - - 1 16,b7c7 f6f2 f1f2 e8e1 f2f1 e1f1,1324,158,88,34,kingsideAttack long mate mateIn3 middlegame sacrifice,https://lichess.org/Cl9T6bjt#31,Ruy_Lopez,Ruy_Lopez_Steinitz_Defense
004nd,3q2k1/2r5/pp3p1Q/2b1n3/P3N3/2P5/1P4PP/R6K b - - 0 24,c7d7 e4f6 d8f6 h6f6,886,75,83,202,crushing fork middlegame short,https://lichess.org/IajkZZBp/black#48,
004sY,8/2k3n1/3p2p1/1KpP2Pp/2P4P/7B/8/8 w - - 0 57,b5a6 c7d8 a6b5 g7f5,2191,95,68,28,crushing endgame short,https://lichess.org/sMrTPfXp#113,
004sg,6k1/p3b2p/1p1pP3/2p3P1/1Pnp3B/P6P/3Q3K/8 w - - 0 38,b4c5 c4d2 c5c6 d6d5 g5g6 e7d6,2531,96,90,787,advantage clearance endgame hangingPiece long quietMove,https://lichess.org/pSRIvt7K#75,
004zI,2q3k1/4br1p/6RQ/1p1n2p1/7P/1P4P1/1B2PP2/6K1 b - - 0 27,h7g6 h6h8,1397,82,88,133,endgame mate mateIn1 oneMove,https://lichess.org/HE33gdt4/black#54,
0050w,5rk1/1p2p1rp/p2p4/2pPb2R/2P1P3/1P1BKP1R/8/8 b - - 4 30,g7g3 h3g3 e5g3 h5g5 g8f7 g5g3,952,78,95,1004,crushing endgame fork long,https://lichess.org/QD8pUcTR/black#60,
0055Y,r1b2rk1/p3pp2/2B4b/2Qpq3/3N2pp/4P3/2P2PPP/1R2K2R b K - 1 23,h6e3 f2e3 e5e3 e1d1,1859,76,92,86,advantage defensiveMove middlegame short,https://lichess.org/7Jpwzowt/black#46,
005HF,3r1rk1/1pR3pp/p2bp3/1q2Np2/3P4/1P5Q/5PPP/4R1K1 w - - 2 27,c7g7 g8g7 h3g3 g7h8,1363,81,68,42,crushing defensiveMove hangingPiece middlegame short,https://lichess.org/IqVPsfjB#53,
005N7,r6k/2q3pp/8/2p1n3/R1Qp4/7P/2PB1PP1/6K1 b - - 0 32,e5c4 a4a8 c7b8 a8b8,667,95,93,1034,backRankMate endgame hangingPiece mate mateIn2 short,https://lichess.org/jxZhmGhg/black#64,
005YX,2rr4/2N2pk1/p1Q1b1pp/1p4q1/3pP3/1B1P4/PPP3PP/6RK w - - 7 25,c7e6 f7e6 c6b7 g7h8,1440,309,100,6,defensiveMove equality middlegame short,https://lichess.org/zbi5w5Qy#49,
005f3,r5k1/2p1pp2/pp4p1/1q1r4/5P2/2QP2R1/PP6/1K4R1 b - - 0 32,d5h5 g3g6 f7g6 g1g6 g8f7 c3g7 f7e8 g7g8 e8d7 g8e6 d7d8 g6g8,2006,73,95,6804,crushing endgame sacrifice veryLong,https://lichess.org/Prb24UzR/black#64,
005jJ,r1b1qrk1/pp1n1pbp/2pp1np1/4p3/2PP1B2/2NBPN1P/PP3PP1/R2Q1RK1 w - - 0 10,d4e5 d6e5 f4h2 e5e4,1438,106,78,15,advantage opening short,https://lichess.org/wt6Q2xGb#19,Queens_Pawn_Game,Queens_Pawn_Game_Other_variations
005qG,8/8/1p1k1p1p/3npp2/2B5/PP1K1PP1/7P/8 b - - 0 36,f5f4 c4d5 f4g3 h2g3 d6d5 g3g4,2244,93,64,46,crushing defensiveMove endgame long,https://lichess.org/RMj9gStA/black#72,
005ws,8/8/5pp1/3K3p/3N2kP/8/8/8 w - - 2 62,d5e6 g6g5 h4g5 f6g5 e6d5 h5h4 d5e4 h4h3 d4f3 g4g3,2306,79,87,371,crushing endgame knightEndgame master quietMove veryLong,https://lichess.org/LOwACSXb#123,
005wy,1r6/pp2kpp1/2n1p1n1/3p2PQ/5P2/2PqP3/PP1N4/2KR3R w - - 3 27,h5h7 c6b4 c3b4 b8c8 d2c4 c8c4,1755,131,100,36,long mate mateIn3 middlegame queensideAttack sacrifice,https://lichess.org/mBQMheB4#53,
005xu,8/3k4/1K1P4/2P3r1/R7/5b2/8/8 b - - 0 68,g5g8 a4a7 d7e6 a7e7 e6d5 d6d7,1930,95,81,26,advancedPawn crushing endgame exposedKing long,https://lichess.org/TDu28XvE/black#136,
005yO,r1r3k1/ppq3bQ/4p2p/4n3/3p4/2P5/PBB2PPP/4R1K1 b - - 2 24,g8f8 b2a3 f8f7 c2d1 c8h8 d1h5 f7f6 h7e4,2792,99,87,194,advantage exposedKing middlegame quietMove veryLong,https://lichess.org/j65YI8hC/black#48,
0061g,6k1/pp3pp1/2p1q1Pp/3b4/8/6Q1/PB3Pp1/3RrNK1 b - - 2 27,e1d1 g3b8 e6e8 b8e8,773,90,72,249,endgame mate mateIn2 short,https://lichess.org/dJ3xEKJK/black#54,
0066C,r2q1r1k/2p3p1/pb2Q2p/1p1p1n2/8/1BP5/PP1B1PPP/3RR1K1 w - - 3 20,b3d5 b6f2 g1f2 f5d4 f2g1 d4e6,1747,77,81,130,advantage discoveredAttack kingsideAttack long middlegame sacrifice,https://lichess.org/ZyuTEP3l#39,
0068B,r1q3k1/4bppp/pp2pn2/4B3/8/2N2Q2/PPPR1PPP/6K1 b - - 0 18,f6d7 d2d7 c8d7 f3a8,1486,74,93,5326,crushing deflection middlegame short,https://lichess.org/LNdzAgWP/black#36,Sicilian_Defense,Sicilian_Defense_Katalimov_Variation
006E1,5rk1/R4pp1/1p5p/3Q4/1PPp2q1/3P2P1/5P2/4nK2 w - - 0 34,f1e1 f8e8 e1f1 g4h3 d5g2 e8e1 f1e1 h3g2,1656,74,97,4771,crushing deflection endgame veryLong,https://lichess.org/KaLKLKD5#67,
006HV,1r6/5k2/2p1pNp1/p5Pp/1pQ1P2P/2P4R/KP3P2/3q4 w - - 4 31,c4c6 b4b3 a2a3 d1a1,1161,78,91,854,endgame mate mateIn2 short,https://lichess.org/ibb2c72C#61,
006NL,1r6/k2qn1b1/p1b1p1p1/2PpPpN1/2nN1P1P/p4B2/1PP2Q2/1K1R3R w - - 0 32,d4c6 e7c6 b2b3 a3a2 b1a1 c4e5 f4e5 g7e5 a1a2 b8b5,2279,114,85,63,advancedPawn advantage middlegame pin veryLong,https://lichess.org/yA3M5Q6W#63,
006RM,1k1r3r/2q5/pp1n2p1/8/1Q6/3R2P1/PPP2P1P/3R2K1 b - - 4 29,c7c5 b4c5 b6c5 d3d6 d8d6 d1d6,1556,75,91,656,crushing long middlegame,https://lichess.org/ceS0QvtT/black#58,
006XF,r5kr/pp1qb1p1/2p4p/3pPb1Q/3P4/2P1B3/PP4PP/R4RK1 b - - 1 17,f5e4 h5f7 g8h7 f1f6 e7f6 f7d7,2368,84,90,1507,advantage long middlegame pin,https://lichess.org/Ynra1LLE/black#34,Russian_Game,Russian_Game_Italian_Variation
006eO,8/8/2p2k2/1p1p4/3P4/1PP1pK2/8/8 b - - 3 64,f6f5 b3b4,2164,118,100,42,defensiveMove endgame equality oneMove pawnEndgame,https://lichess.org/2cHqPgSG/black#128,
006of,r2qr2k/1pp2pp1/1b4np/pP2P3/P4n2/BQN2N1P/5PP1/R3R1K1 w - - 3 20,b3f7 d8d3 c3e2 f4e2 e1e2 d3e2,2367,84,89,377,advantage kingsideAttack long middlegame,https://lichess.org/MIdWd89x#39,
006om,1r3k2/5p1p/2p1pp2/P2n4/2r1N3/P4PK1/2R2P1P/2R5 b - - 9 29,c4a4 e4c5 a4a5 c5d7 f8g7 d7b8,1905,75,98,1338,crushing endgame fork long master,https://lichess.org/BMIgw1OR/black#58,
006wz,2r5/4ppkp/5bp1/1p6/1P6/P3B3/2r2PPP/1R1R2K1 b - - 2 22,f6b2 b1b2 c2b2 e3d4 f7f6 d4b2,1315,75,93,312,attraction crushing endgame fork long sacrifice,https://lichess.org/qT0W6o27/black#44,
006x0,3Q4/5kr1/8/1P2pB2/2Pp1n2/q2P3P/7K/5R2 w - - 7 49,d8d7 f7f6 d7d8 f6f5,1382,208,100,11,defensiveMove endgame equality short,https://lichess.org/yJzYpNj0#97,
006yP,6R1/8/Kpk1p3/1p1pP3/6P1/PPP1r3/8/8 b - - 3 40,e3c3 g8c8 c6d7 c8c3,806,81,80,130,crushing endgame master rookEndgame short skewer,https://lichess.org/vf9MOLH1/black#80,
0070J,r4rk1/ppq2ppp/2nbp1b1/3p4/3Pn3/2PB1N1P/PP3PP1/R1BQRNK1 b - - 4 14,e4f2 g1f2 g6d3 d1d3,984,90,61,76,advantage hangingPiece middlegame short,https://lichess.org/SHqFVu02/black#28,Caro-Kann_Defense,Caro-Kann_Defense_Exchange_Variation
0072T,3q1nk1/1bN2rpp/pp1P4/1N6/4n2b/8/PPP2PPP/R1BQ1RK1 w - - 1 16,b5d4 h4f2 f1f2 e4f2,1685,86,88,49,advantage kingsideAttack master middlegame short,https://lichess.org/aqhibPRF#31,Philidor_Defense,Philidor_Defense_Lion_Variation
00761,3r2k1/1b3pbR/p2P2P1/3p2N1/2p5/2P2N2/PP6/2K5 b - - 0 28,f7g6 h7g7 g8g7 g5e6 g7g8 e6d8,1466,75,96,8599,attraction crushing endgame exposedKing fork long sacrifice,https://lichess.org/vu70Maig/black#56,
0078T,rk5r/1b3R2/pp2p2q/4P2p/B2p3B/4R2P/PP4P1/5Q1K b - - 0 27,d4e3 f7b7 b8b7 f1f7 b7b8 h4e7,2286,80,80,77,attraction crushing defensiveMove exposedKing long middlegame queensideAttack sacrifice,https://lichess.org/mXf4gFYU/black#54,
007AS,r3kb1r/3nnpp1/4p1bp/1NppP3/3P4/6N1/P2BBPPP/R3K2R b KQkq - 0 17,a8b8 b5d6 e8d8 d2a5,1588,87,78,25,crushing master middlegame short,https://lichess.org/Nfuw1Dug/black#34,Caro-Kann_Defense,Caro-Kann_Defense_Advance_Variation
007Rn,4r1k1/p4p1p/1p6/6q1/3P2n1/P4Q2/1P1B2P1/7K w - - 0 34,d2g5 e8e1 f3f1 e1f1,994,81,75,71,endgame mate mateIn2 short,https://lichess.org/L9kH7FqT#67,
007XE,2kr3r/p1p1bpp1/2p2n1p/8/8/1P6/P1P1RPPP/RNB3K1 w - - 1 16,e2e7 d8d1 e7e1 d1e1,895,137,69,15,backRankMate fork mate mateIn2 middlegame short,https://lichess.org/f4f7UwiT#31,Kings_Pawn_Game,Kings_Pawn_Game_Leonardis_Variation
007eS,6k1/p4p2/1p5p/4r3/P3B3/1P3P2/2PK2PP/8 w - - 0 29,d2e3 f7f5 g2g4 f5e4,1169,74,100,4271,advantage endgame short,https://lichess.org/8qs8bafy#57,
007gO,2r3rk/5p2/4p2p/4q3/1Q6/8/1P3PPP/R4RK1 w - - 0 31,a1c1 e5g5 g2g3 c8c1,2163,87,74,42,crushing endgame short,https://lichess.org/id1brvZc#61,
007ku,r1bq3Q/1np2kp1/p5B1/1p1Pp3/1Pn2BP1/2b2P2/P3K3/R4N2 b - - 5 35,f7g6 h8h5 g6f6 f4g5,1695,77,94,763,mate mateIn2 middlegame short,https://lichess.org/QveLbBjG/black#70,
0088O,7Q/2p5/1p2prp1/p4k1p/P4p1P/8/6RK/3q4 b - - 2 37,d1a4 g2g5 f5e4 h8f6,1121,76,100,89,crushing deflection endgame short,https://lichess.org/GmH1DPx6/black#74,
008D5,r1bqk2r/pp3ppp/4p2n/3pP3/1b1P1P2/2N5/PP4PP/R1BQKB1R b KQkq - 2 9,h6f5 d1a4 c8d7 a4b4,1234,74,82,1136,advantage fork master opening short,https://lichess.org/jIGC2FuP/black#18,
008GK,1k1r4/ppp3p1/8/1P5p/8/P3n2P/2P1r1P1/B3NRK1 b - - 4 31,d8d1 f1f8 d1d8 f8d8,656,79,97,786,backRankMate endgame mate mateIn2 short,https://lichess.org/9vFFDYsH/black#62,
008LT,r4rk1/6p1/b3p1nN/p1pp4/1p3P1q/3P1Q1B/PPP2PK1/R6R b - - 0 26,g8h8 h6f7 f8f7 h3e6,1631,332,100,3,crushing kingsideAttack middlegame pin sacrifice short,https://lichess.org/vnxisKeU/black#52,
008Nz,6k1/2p2ppp/pnp5/B7/2P3PP/1P1bPPR1/r6r/3R2K1 b - - 1 29,d3e2 d1d8,669,104,89,350,backRankMate mate mateIn1 middlegame oneMove,https://lichess.org/HNU4zavC/black#58,
008P4,8/4k3/1p1p4/rP2p1p1/P2nP1P1/3BK3/8/R7 w - - 0 35,e3d2 d4b3 d2c3 b3a1,760,78,98,982,crushing endgame fork short,https://lichess.org/3GoHPRp3#69,
008Sk,8/6pp/3Bp2k/p2pP2P/P2bp1PK/8/r7/5R2 b - - 2 37,d4f2 f1f2 g7g5 h4g3 a2f2 g3f2,1869,78,93,7324,crushing endgame long,https://lichess.org/rah6MiKa/black#74,
008lc,7k/pb1qn2n/1p2R2Q/2p2p2/2Pp4/3B4/PP3PrP/4RK2 b - - 1 27,g2g7 h6g7 h8g7 e6e7 d7e7 e1e7,1918,75,92,879,attraction crushing exposedKing fork long middlegame,https://lichess.org/UdZXrVA5/black#54,
008nF,2rq1rk1/7p/1n4pb/1R2p3/pPpP1P2/P1B5/3NQ1PP/2R3K1 w - - 0 31,e2e5 f8e8 e5e8 d8e8,2235,77,90,432,crushing master middlegame short trappedPiece,https://lichess.org/tYO5rrIU#61,
008o6,Q5k1/p1p3p1/5rP1/8/3P4/7P/q3r3/B4RK1 b - - 1 34,f6f8 a8f8,1325,370,100,6,endgame mate mateIn1 oneMove,https://lichess.org/1k4lXfEi/black#68,
008oX,4r1k1/2R3pp/2p4q/1p1p4/3P4/P7/1PP2R2/1K1N4 b - - 3 32,e8e1 c7c8 e1e8 c8e8,974,75,68,216,endgame mate mateIn2 short,https://lichess.org/APGKH8YH/black#64,
008tL,8/7k/pR5p/3p4/5r2/2P1p2P/P5P1/6K1 w - - 0 40,b6a6 e3e2 a6e6 f4f1,1044,76,96,1695,advancedPawn crushing endgame master rookEndgame short,https://lichess.org/yhNupFCi#79,
0092V,r2qk1nr/ppp3pp/2n5/1B1pp3/1b1P4/5Q1P/PP1B1PP1/RN2K2R b KQkq - 3 11,e5e4 b5c6 b7c6 f3h5 g7g6 h5e5,2060,91,83,26,crushing exposedKing long opening,https://lichess.org/bW5LiCa5/black#22,Ponziani_Opening,Ponziani_Opening_Other_variations
0092z,2r3k1/2qR1ppp/p7/2p2Q2/P7/7P/5PP1/6K1 b - - 3 26,c7c6 f5f7 g8h8 f7g7,1070,80,94,368,endgame mate mateIn2 short,https://lichess.org/fjaha7q0/black#52,
009De,r1q4r/2p1kP2/3p4/2pPp3/p1P1Pb2/P1NB3b/1P3KP1/R2Q1R2 w - - 1 23,g2h3 c8h3 d1f3 h3h2 f3g2 f4e3 f2f3 h8h3 g2h3 h2h3,2016,83,79,45,advantage exposedKing middlegame veryLong,https://lichess.org/PsMgMg87#45,
009FS,r2qr1k1/p5bp/1pp1b1p1/8/2QN1p2/2P1n2P/PP3PP1/R1B1RNK1 w - - 1 18,d4e6 e3c4 e6d8 e8e1,1734,76,75,121,crushing discoveredAttack opening short,https://lichess.org/MOdm5bE7#35,Sicilian_Defense,Sicilian_Defense_Closed
009IO,3rk3/5p1r/p2Np1p1/3bP3/P2n4/8/1P3RPP/5RK1 b - - 4 25,e8e7 f2f7 h7f7 f1f7,1174,80,87,528,hookMate mate mateIn2 middlegame short,https://lichess.org/LJBrm9Or/black#50,
009L0,6k1/pb2r1pN/1n4Bp/3p4/1P2pR2/P7/3R1PPP/2r3K1 w - - 2 30,d2d1 c1d1,706,146,18,18,backRankMate hangingPiece mate mateIn1 middlegame oneMove,https://lichess.org/SAhQtou2#59,
009Os,r2b2k1/1p3q1p/p2p4/3P2p1/2P1PRQr/8/P2B3P/2R4K w - - 1 29,g4g3 h4f4 d2f4 f7f4 g3f4 g5f4,1447,93,76,34,crushing long middlegame,https://lichess.org/AdjEnXlm#57,
009Wc,1r3rk1/1pq2pbp/p1p1pnp1/2N1N3/3P4/1QP5/PP3PPP/3RR1K1 w - - 2 19,e5d7 f6d7 c5d7 c7d7,996,78,95,1210,crushing middlegame short,https://lichess.org/WnthPrdl#37,Caro-Kann_Defense,Caro-Kann_Defense_Classical_Variation
009XT,rn1qk2r/pp3ppp/3bp1b1/3p4/3Pn2N/3BB3/PPP2PPP/RN1Q1RK1 w kq - 4 10,h4g6 d6h2 g1h1 h7g6,1978,72,94,7413,crushing intermezzo opening short,https://lichess.org/bf23N8Ng#19,Caro-Kann_Defense,Caro-Kann_Defense_Exchange_Variation
009f8,8/1p4p1/pb2ppkp/3n4/3P4/P3BN1P/1P2KPP1/8 b - - 0 26,g6f5 f3h4 f5e4 f2f3,1183,77,87,84,endgame mate mateIn2 short,https://lichess.org/paDYagZM/black#52,
009lk,1R6/6pk/2p4p/3bP2r/5B1P/2P2qP1/P4P1Q/4R1K1 w - - 2 40,e1e3 f3d1 e3e1 d1e1,1186,151,100,37,mate mateIn2 middlegame short,https://lichess.org/gLNPef4f#79,
009tE,6k1/6pp/p1N2p2/1pP2bP1/5P2/8/PPP5/3K4 b - - 1 28,f6g5 c6e7 g8f7 e7f5,618,101,90,393,crushing endgame fork short,https://lichess.org/fUV1iXBx/black#56,
009zR,3r4/p1p2ppp/4k3/6Q1/5P2/4P3/Prqn2PP/3R1RK1 w - - 3 22,g5d8 d2f3 g1h1 c2g2,1591,79,79,164,discoveredAttack endgame mate mateIn2 short,https://lichess.org/SctCD3fJ#43,
00A1H,2r3k1/4brp1/2p3b1/2Pp1q1p/3B3P/2P2N2/PP3P1K/R2Q2R1 w - - 1 31,f3g5 f5f4 h2g2 e7g5,2039,85,79,199,crushing middlegame short,https://lichess.org/GeoPB5fa#61,
00A5v,4r1k1/pp1qr1p1/7p/2pPR3/2P2p2/1PQ2P2/P5PP/4R1K1 w - - 3 33,c3d2 e7e5 e1e5 e8e5,697,83,90,539,crushing endgame short,https://lichess.org/1WXk6Mn2#65,
00AB1,8/7Q/3p1kp1/1p6/2b5/2P4P/5PPK/4q3 b - - 8 36,e1c3 h7h8 f6e6 h8c3,1148,75,95,6705,crushing endgame short skewer,https://lichess.org/KQDr21Ph/black#72,
00AHY,r6k/3NR1p1/4n2p/5b2/p6P/6R1/8/6K1 w - - 2 43,h4h5 a4a3 g3a3 a8a3 e7e8 h8h7,1375,75,90,1413,advantage endgame long,https://lichess.org/SFxNjHBp#85,
00AVR,br1qkb1r/p1pp1ppp/4Pn2/6B1/3Qn3/5NP1/P3PPBP/RN1R2K1 b k - 0 15,d7e6 d4a4 d8d7 d1d7,1912,78,71,39,crushing opening short,https://lichess.org/KxeQFmHl/black#30,Zukertort_Opening,Zukertort_Opening_Black_Mustang_Defense
00Aae,1R6/1P6/4pkp1/5p2/3P3p/3KP3/8/1r6 b - - 0 43,h4h3 b8f8 f6e7 b7b8q b1b8 f8b8,1019,78,87,333,advancedPawn clearance crushing endgame long promotion rookEndgame,https://lichess.org/mLIjph1r/black#86,
00Aas,3r1rk1/1p2q1pp/5p2/8/1P1n4/6Q1/PPbB1PPP/R2B1RK1 w - - 9 20,d1c2 d4e2 g1h1 e2g3 f2g3 d8d2,1435,76,99,1351,crushing fork long middlegame,https://lichess.org/wYjuq3zz#39,
00Af3,8/8/2B2p1p/P4Pp1/3p1kP1/1b1Pb2P/8/4K3 b - - 0 50,f4g3 a5a6 b3c4 a6a7,1170,75,95,2677,advancedPawn bishopEndgame crushing endgame short,https://lichess.org/JBQDYKyD/black#100,
00Ahb,1k4nr/pp1r1ppp/4p3/1Nb2q2/2Pp4/6P1/PP3P1P/R1BQR1K1 b - - 2 14,g8h6 c1f4 f5f4 g3f4,1206,78,90,132,crushing middlegame short,https://lichess.org/Cyj8Qkox/black#28,Sicilian_Defense,Sicilian_Defense_Franco-Sicilian_Variation
00Al5,2r3k1/p2q1pbp/1p2pnp1/nB1p4/3P4/1Pr1P2P/P1QB1PP1/2R2RK1 w - - 0 19,b5d7 c3c2 d7c8 c2d2,1736,75,93,1066,advantage middlegame short,https://lichess.org/EtyflSie#37,Slav_Defense,Slav_Defense_Schlechter_Variation
00AoZ,8/1R6/p1pk4/6bp/1QP5/P7/KP6/3r2q1 b - - 2 44,g1c5 b7d7 d6d7 b4c5,1041,75,95,2749,advantage deflection endgame short,https://lichess.org/356BAYqk/black#88,
00AuR,8/4bkp1/R6P/4p3/Pp2P3/1P1rB3/6P1/6K1 b - - 0 33,d3e3 h6h7 e3e1 g1h2,1662,84,83,30,advancedPawn crushing endgame short,https://lichess.org/NQjprK7P/black#66,
00B3B,2K5/3P4/5b2/p1B5/P7/3k4/6p1/8 w - - 7 77,d7d8q f6d8 c8d8 d3c4,1453,75,93,901,crushing endgame short,https://lichess.org/b7iJvp5Z#153,
00B5A,r2qk2r/ppp2ppp/2n1b3/1B1N4/3b4/3P3P/P1P1QPP1/1R2K1NR w Kkq - 4 13,g1f3 d8d5 f3d4 d5d4 b5c6 b7c6,1486,75,95,12768,advantage hangingPiece long middlegame,https://lichess.org/JCYgLgB2#25,Nimzowitsch_Defense,Nimzowitsch_Defense_Other_variations
00B7G,1rb2r1k/4q2p/p2p4/3B1p2/1pPb4/1P2NQ2/P5PP/2R2RK1 w - - 1 24,g1h1 e7e3 f3e3 d4e3,1714,74,86,139,crushing middlegame short,https://lichess.org/jBgjHSYd#47,
