00Yjy,6k1/5p1p/B2bp2q/5p2/6rP/1P4P1/1Q3P2/5R1K w - - 3 34,f1d1 g4h4 g3h4 h6h4 h1g2 h4g4 g2f1 g4d1,2001,78,68,54,crushing endgame exposedKing fork sacrifice veryLong,https://lichess.org/f0Kyo2Fh#67,
00Yqw,1Qbk1b1r/4rpp1/p1BP3p/8/3q4/6P1/1PP3PP/1K5R b - - 0 33,e7d7 c6d7 d4c5 d7c8,1938,76,67,47,crushing middlegame pin short,https://lichess.org/bJncxL9v/black#66,
00Yuf,5rk1/n1q2ppp/1p1bpn2/1B1p1b2/NP1P4/P3PN2/3B1PPP/3Q1RK1 w - - 0 19,b5e2 f5c2 d1a1 c2a4,1924,73,95,7685,advantage interference middlegame short,https://lichess.org/1vvu6Sdh#37,Slav_Defense,Slav_Defense_Quiet_Variation
00ZAn,rnbqk1nr/ppp1b1pp/3p4/4p3/2B1P3/5N2/PPPP2PP/RNBQK2R w KQkq - 0 6,f3e5 d6e5 d1h5 g7g6 h5e5 g8f6,1725,76,89,73,advantage hangingPiece long opening,https://lichess.org/uS929Njx#11,
00ZEW,r1b5/pppqNkp1/3p3p/6rn/1PP2p1N/P5P1/4Q2P/4RRK1 b - - 3 22,g5e5 e2h5 e5h5 f1f4 f7e8 e7g6,2339,76,90,1044,advantage discoveredAttack long middlegame pin sacrifice,https://lichess.org/cjMxj5uZ/black#44,
00ZEc,1r3bk1/5p2/3P1qRP/r1n1p3/ppB5/P2Q1P2/1PP5/1K6 b - - 0 35,g8h7 g6g7 h7h6 d3h7,1788,77,97,9099,doubleCheck mate mateIn2 middlegame short,https://lichess.org/7IfLNNVB/black#70,
00ZK8,r1bq1b1r/pp3kpp/3p1n2/3Q4/2n1P3/5N2/PP3PPP/RNB1K2R b KQ - 1 10,c8e6 f3g5 f7g6 d5e6,2380,83,100,35,advantage deflection opening short,https://lichess.org/NOQlRyAF/black#20,Sicilian_Defense,Sicilian_Defense_Old_Sicilian
00ZKw,rn1q1r1k/ppp5/1b2ppQ1/6B1/8/2P5/PP4PP/RN3R1K w - - 2 18,f1f6 d8d1 f6f1 f8f1,1041,105,54,21,backRankMate mate mateIn2 middlegame short,https://lichess.org/eyMv5HY5#35,Kings_Gambit_Accepted,Kings_Gambit_Accepted_Kings_Knights_Gambit
00ZPK,5r2/R2R1pk1/P7/5pp1/8/1KP5/5r2/8 b - - 0 44,g5g4 d7f7 f8f7 a7f7 g7f7 a6a7,742,76,100,458,advancedPawn advantage endgame long master rookEndgame sacrifice,https://lichess.org/Y6yYxIcG/black#88,
00ZWf,r1b2bnr/ppQp3p/2n2q1k/6pP/2B1P3/3P4/PPP2PP1/RNB1K2R w KQ - 1 11,c2c3 f8d6 c7d6 f6d6,1334,75,90,540,crushing middlegame short trappedPiece,https://lichess.org/bFAkQOCQ#21,Kings_Pawn_Game,Kings_Pawn_Game_Damiano_Defense
00ZeT,1Q1k4/4r3/2q4p/2p1pp1P/2Bb4/1P6/P6K/4R3 b - - 4 43,d8d7 c4b5 c6b5 b8b5,1411,75,95,14395,crushing endgame pin short,https://lichess.org/c6iAy1Zc/black#86,
00Zks,8/P1R4p/5pk1/4q1p1/5P2/6KP/5QP1/7r b - - 0 51,e5c7 a7a8q c7c3 a8f3,1800,76,82,80,advancedPawn advantage defensiveMove endgame promotion short,https://lichess.org/CPhnVb98/black#102,
00a2M,r3r1k1/ppp2p1p/3p2pQ/8/1q6/3B1N2/nBK3PP/7R b - - 3 22,b4c5 c2b3 e8e5 f3e5 d6e5 h6h4,2080,215,-33,8,advantage defensiveMove long middlegame,https://lichess.org/PReNb2iq/black#44,
00a98,4r1k1/p4p2/1p3q1p/1P6/3b2p1/P3B1P1/Q1P2PKP/4R3 w - - 0 32,e3d4 f6f3 g2f1 f3h1,1623,96,81,18,endgame mate mateIn2 short,https://lichess.org/pgdIGRB3#63,
00aBq,r2r2k1/pp3ppp/1qn2b2/3R4/4QB2/1P3N2/P4PPP/4R1K1 b - - 0 18,d8d5 e4e8 a8e8 e1e8,920,77,88,295,backRankMate mate mateIn2 middlegame sacrifice short,https://lichess.org/0AybhVJm/black#36,Queens_Pawn_Game,Queens_Pawn_Game_London_System
00aDl,r5k1/1p3p2/2p1ppp1/3p4/2nP4/1QB2B1P/rPP2PP1/qNKR3R w - - 3 22,f3e2 a1b1 c1b1 a2a1,1422,72,96,13738,attraction mate mateIn2 middlegame queensideAttack sacrifice short,https://lichess.org/pc79SSEd#43,
00aEe,rn3rk1/p4p1p/1p4p1/2p5/3n2PP/2Q4N/qPP3B1/2KR3R w - - 2 19,g2a8 d4e2 c1d2 e2c3,1434,183,53,4,crushing fork middlegame short,https://lichess.org/sWKGI4XE#37,French_Defense,French_Defense_Paulsen_Variation
00aL1,8/5pr1/1Q4k1/p2pp3/5Rp1/6P1/5PKP/3q4 b - - 1 33,g6h7 f4f5 d1f3 f5f3,2004,80,63,53,advantage endgame short,https://lichess.org/UKybXdi1/black#66,
00aME,r1b2rk1/2qnbppp/3p1n2/1pp5/4PP2/1PNQ1N2/P3B1PP/1RB2RK1 w - - 0 14,d3b5 c8a6 b5a6 a8a6,1419,76,85,558,advantage middlegame short,https://lichess.org/16LXTr5C#27,Center_Game,Center_Game_Other_variations
00aYp,2rq1rk1/p1n1bp2/1p2p1pN/3nP2p/3P3P/P2Q1N2/1P4P1/RBB3K1 b - - 1 21,g8g7 h6f7 f8f7 d3g6,1752,79,71,65,crushing master middlegame short,https://lichess.org/AaaUgm4I/black#42,
00abm,r1b1k2r/ppp2p2/2nppq1p/3P2p1/1bP3P1/2N2N2/PP2PPP1/2RQKB1R b Kkq - 0 11,c6e5 d1a4 e8f8 a4b4,1350,76,56,191,crushing fork middlegame short,https://lichess.org/6xRIE4k2/black#22,English_Opening,English_Opening_Anglo-Indian_Defense
00ae5,2r1kb1r/1p3pp1/pqn1pnp1/3p4/1P1P1B2/P1N2N1P/2P2PP1/R2QK2R b KQk - 0 13,c6b4 c3a4 b6b5 a3b4,2222,220,100,8,equality middlegame short,https://lichess.org/VPTKzgUW/black#26,
00agR,8/5pp1/p4n1p/1p2k3/8/1PK1P3/P1B2P1P/8 w - - 2 31,h2h3 f6e4 c2e4 e5e4,1500,500,100,0,crushing endgame short,https://lichess.org/MUIpGzM3#61,
00asK,2r3k1/R4ppp/8/4P3/4Q3/1qn3B1/5PPP/2R3K1 w - - 0 30,c1c3 b3d1 e4e1 d1e1,1639,284,100,6,endgame mate mateIn2 short,https://lichess.org/hlWKSG6i#59,
00awL,4q1r1/k2r1Rp1/ppp4p/2Qp4/3P4/2P1P3/PP4P1/2K2R2 w - - 0 35,c5c6 d7f7 f1f7 e8f7,1610,82,79,90,crushing endgame short,https://lichess.org/TPaROV8B#69,
00b6f,6k1/8/5B2/1R3pK1/6p1/6P1/P4P1q/8 w - - 0 41,g5f5 h2h5 f6g5 h5f7 f5g4 f7c4,1700,96,74,25,crushing endgame long,https://lichess.org/8DcVY76B#81,
00b7t,r2qr1k1/pb3pp1/1p4n1/3p4/1P2p2p/P1P1N1P1/2Q1PPBP/3R1RK1 w - - 0 20,g2e4 e8e4 c2e4 d5e4 d1d8 a8d8,1494,76,86,105,advantage long middlegame,https://lichess.org/USUzRjja#39,
000hf,r1bqk2r/pp1nbNp1/2p1p2p/8/2BP4/1PN3P1/P3QP1P/3R1RK1 b kq - 0 19,e8f7 e2e6 f7f8 e6f7,1595,77,88,448,mate mateIn2 middlegame short,https://lichess.org/71ygsFeE/black#38,Horwitz_Defense,Horwitz_Defense_Other_variations
